SYSNO;AUTOR;TÍTULO;ANO DE DEFESA;NOME DEPARTAMENTO;SIGLA DEPARTAMENTO;ÁREA DE CONCENTRAÇÃO;ASSUNTOS;ORIENTADOR;RESUMO;ABSTRACT
3061472;Pássaro, Ana Laura;Resina composta com tecnologia giomer comparada ao cimento de ionômero de vidro de alta viscosidade para restaurações atraumáticas ocluso-proximais em molares decíduos: ensaio clínico randomizado com 24 meses de acompanhamento;2021;;ODO;ODONTOPEDIATRIA E ORTODONTIA;ANÁLISE DE SOBREVIVÊNCIA||CÁRIE DENTÁRIA||CIMENTOS DE IONÔMEROS DE VIDRO||ODONTOPEDIATRIA;Raggio, Daniela Prócida;O objetivo desta tese é relatar os achados de um ensaio clínico randomizado de superioridade conduzido em ambiente escolar, cujo desfecho primário foi avaliar a longevidade de restaurações atraumáticas (ART) ocluso-proximais de molares decíduos, utilizando uma resina composta com tecnologia giomer associada a um sistema adesivo universal de passo único (RCG - Beautifil Bulk Fill® e BeautiBond®) e um cimento de ionômero de vidro de alta viscosidade encapsulado (CIV - Equia Forte®). O objetivo secundário deste estudo foi avaliar a custo-efetividade destas intervenções. Os desfechos primário e secundário foram relatados de acordo com as normas CONSORT e CHEERS, respectivamente. Cento e oitenta e duas crianças com idade entre 4 e 8 anos de idade que estavam matriculadas em escolas municipais de Cerquilho (SP, Brasil) foram incluídas e randomizadas para os grupos, de acordo com o material restaurador. Apenas um dente foi incluído por criança e todas elas foram tratadas de acordo com a filosofia do ART, em ambiente escolar. As restaurações foram avaliadas por uma examinadora treinada e calibrada após 3, 6, 12, 18 e 24 meses de acordo com os critérios de Roeleveld et al., 2006 e apenas as restaurações sem nenhuma necessidade de reparo foram classificadas como sucesso. Para avaliar a sobrevida da restauração, foram feitos a análise de sobrevida de Kaplan Meier e o teste de Log-rank. A regressão de Cox testou a relação entre a sobrevida dos materiais e as variáveis coletadas. Os||custos profissionais e materiais foram considerados para estimar o custo incremental dos tratamentos. A regressão de Bootstrap com 1000 replicações foi utilizada para avaliar o custo total dos tratamentos. A simulação matemática de Monte-Carlo foi usada para construir um plano de custo-efetividade com 10.000 situações simuladas. Todos os testes foram ajustados em um nível de significância de 5%. Após 24 meses, 161 restaurações foram avaliadas (88,5% da amostra) e 177 restaurações foram avaliadas ao menos uma vez durante o acompanhamento do estudo (2,75 % de perda de seguimento). A sobrevida média geral das restaurações após 24 meses foi de 53,5% (CIV=58,1% e RCG=49,1%). Não houve diferença na longevidade entre os materiais restauradores (p=0,199). Nenhuma das variáveis coletadas influenciou a sobrevida das restaurações. A longevidade da RCG não é superior à do CIV em restaurações ocluso-proximais de molares decíduos. Houve diferença estatisticamente significativa entre o custo total das restaurações dos grupos deste estudo, sendo que o CIV se apresenta com custo superior em até 38% após 24 meses de acompanhamento, e a RCG se mostrou como a opção mais custo-efetiva. Apesar de não ter superado a longevidade do CIV para restaurações ocluso-proximais de molares decíduos, a RCG mostrou-se como uma opção custo-efetiva, mostrando-se como uma alternativa viável de material restaurador na técnica do ART;The aim of this thesis is to report the findings of a superiority randomized clinical trial conducted in a school setting, in which the primary outcome was to evaluate the longevity of occluso-proximal atraumatic restorations (ART) of primary molars using a giomer technology composite resin associated with a single-step universal adhesive (GCR - Beautifil Bulk Restorativel® and BeautiBond®) and an encapsulated high-viscosity glass ionomer cement (GIC - Equia Forte®). The secondary endpoint of this study was to evaluate the cost-effectiveness of these interventions. Primary and secondary outcomes were reported according to the CONSORT and CHEERS guidelines, respectively. One hundred and eighty-two children aged 4 to 8 years old who were attending public schools in Cerquilho (SP, Brazil) were included and randomized to groups according to the restorative material. Only one tooth was included per child and all of them were treated according ART premises, in school setting. Restorations were evaluated by single trained and calibrated examiner after 3, 6, 12, 18 and 24 months according to Roeleveld et al., 2006 criteria and only restorations with no repair needs were classified as successful. To assess restoration survival, Kaplan Meier survival analysis and the Log-rank test were performed. Cox regression tested the association between survival of materials and the variables collected. Professional and material costs were considered to estimate the incremental cost of||treatments. Bootstrap regression with 1000 replications was performed to assess the total cost of treatments. Monte-Carlo mathematical simulation was used to generate a cost-effectiveness plan with 10,000 simulated situations. All tests were adjusted at a 5% significance level. After 24 months, 161 restorations were evaluated (88.5% of the sample) and 177 restorations were evaluated at least once during the study follow-up (2.75% loss to follow-up). The overall mean survival of restorations after 24 months was 53.5% (GIC=58.1% and GCR=49.1%). There was no difference in longevity between restorative materials (p=0.199). None of the variables collected influenced the survival of the restorations. The longevity of GCR is not superior to GIC in occluso-proximal restorations in primary molars. There was a statistically significant difference between the total cost of the restorations of the groups in this study, with the GIC being approximately 38% more expensive after 24 months of follow-up, and the GCR proved to be the most cost-effective option. Although it did not overcome the longevity of GIC for occluso-proximal restorations of primary molars, GCR proved to be a cost-effective option, proving to be a viable alternative of restorative material in the ART technique
3061476;Ronchim, Victor dos Santos;A study in set-theoretic functional analysis: extensions of C_0(I)-valued operators on linearly ordered compacta and weaker forms of normality on Psi-spaces;2021;;MAT;MATEMÁTICA;ANÁLISE FUNCIONAL||TOPOLOGIA CONJUNTÍSTICA;Oliveira, Claudia da Silva||Tausk, Daniel Victor;Na primeira parte deste trabalho nós investigamos generalizações do clássico teorema de Sobczyk, que afirma que todo operador limitado valorado a {dollar}c_0{dollar} e definido em um subespaço fechado de um espaço de Banach separável admite uma extensão limitada. Em direção a este objetivo, nós exploramos a generalização deste problema quando o espaço {dollar}c_0{dollar} é substituído pela sua versão não separável {dollar}c_0(I){dollar}, abordando o problema de estender operadores limitados definidos em uma subálgebra de Banach unital de {dollar}C(K){dollar}, onde {dollar}K{dollar} é um compacto totalmente ordenado em uma tentativa de generalizar os resultados de D.V. Tausk e C. Correa. Nós descrevemos uma classe de compactos totalmente ordenados, chamada de separavelmente determinada, onde os critérios para extensão de operadores valorados a {dollar}c_0{dollar} e para operadores valorados a {dollar}c_0(I){dollar} coincidem. Na segunda parte, nós examinamos enfraquecimentos de normalidade em espaços de Mrówka-Isbell. Estudamos o conceito de semi-normalidade nestes espaços, provendo resultados estruturais que conectam normalidade, semi-normalidade e quase-normalidade. Nós definimos o conceito de separação, chamado fortemente||{dollar}(\aleph_0, <\mathfrak c){dollar}-separado, e provamos a existência genérica de famílias quase disjuntas, completamente separáveis e fortemente {dollar}(\aleph_0, <\mathfrak c){dollar}-separadas sob a hipótese {dollar}\mathfrak s=\mathfrak c{dollar} and {dollar}\mathfrak b=\mathfrak c{dollar}, respondendo uma questão proposta por P. Szeptycki e S. Garcia-Balan.;In the first part of this work we investigate generalizations of the classical theorem of Sobczyk, which states that every {dollar}c_0{dollar}-valued bounded operator defined on a closed subspace of a separable Banach space admits a bounded extension to the entire space. Towards this goal, we explore the generalization of this problem when {dollar}c_0{dollar} is replaced by the non-separable space {dollar}c_0(I){dollar}, addressing the problem of extending bounded operators defined on Banach unital subalgebras of {dollar}C(K){dollar}, where {dollar}K{dollar} is a linear compact space in an attempt to extend the results of D.V. Tausk and C. Correa. We describe a class of linear compact spaces, called separably determined, where the criteria for extending {dollar}c_0{dollar}-valued operators and the one for extending {dollar}c_0(I){dollar}-valued operators are the same. On the second part of this work we examine weaker forms of normality in Mrówka-Isbell spaces. We study the concept of semi-normality in spaces providing structural results connecting normality, semi-normality and almost-normality. We define the separation concept of strongly||{dollar}(\aleph_0, <\mathfrak c){dollar}-separated almost disjoint families and prove the generic existence of completely separable strongly {dollar}(\aleph_0, <\mathfrak c){dollar}-separated almost disjoint families under the assumption {dollar}\mathfrak s=\mathfrak c{dollar} and {dollar}\mathfrak b=\mathfrak c{dollar}, answering a question from P. Szeptycki and S. Garcia-Balan.
3061478;Santos, Felipe Albino dos;Álgebras de Krichever-Novikov superelípticas;2021;;MAT;MATEMÁTICA;POLINÔMIOS ORTOGONAIS||ÁLGEBRA;Futorny, Vyacheslav;Este trabalho apresenta um estudo das álgebras de Krichever-Novikov superelípticas. Seja p(t) C[t] um polinômio com raízes distintas e g uma álgebra de Lie simples de dimensão finita sobre os complexos. É apresentada uma descrição em termos de geradores e relações da extensão central universal para a álgebra de Lie afim superelíptica gR em que R=C[t,t1,u] em que u m=p(t) (mN). Dos geradores e relações apresentados emergem famílias de polinômios. É apresentada uma análise destas famílias e obtém-se desta análise uma família de polinômios que satisfazem determinada equação diferencial de ordem 4. Mostra-se que tal família é de polinômios ortogonais não-clássicos. Além disso, neste trabalho é definida a álgebra de Heisenberg hiperelíptica como a subálgebra de Heisenberg da álgebra hiperelíptica laço de Krichever-Novikov. É estabelecido um critério de irredutibilidade explícito para módulos -Verma para estas álgebras. Cada capítulo descreve de forma concisa eventos e personagens da História da Matemática relacionada aos tópicos apresentados;The present work addresses the Krichever-Novikov superelliptic algebras. Let p(t) C[t] be a polynomial with distinct roots and g a simple Lie algebra over the complex numbers. The universal central extension of the infinite dimensional superelliptic affine Lie algebra g R in which R = C[t, t1, u] where u m = p(t) (m N) is described in terms of generators and relations. This description leads to special families of polynomials. We show that these polynomials satisfy certain fourth order differential equations and conclude that they are orthogonal and non- classical polynomials. Furthermore, we define the hyperelliptic Heisenberg algebra as the Heisenberg subalgebra of a hypereliptic loop Krichever-Novikov algebra and we stabilish a explicit irreducibility criteria for -Verma modules for these algebras. Each chapter provides a short description of events and characters from the History of Mathematics related to the presented topics
3061543;Costa, Andre Ricardo Reis;Estudos sobre o valor dos investimentos em pesquisa e desenvolvimento e a dicotomia entre empresas de alta e baixa tecnologia;2021;;EAD;ADMINISTRAÇÃO;INOVAÇÃO||PROJETOS DE PESQUISA||INVESTIMENTOS||COVID-19;Kayo, Eduardo Kazuo;A presente tese é composta por três artigos, um teórico e dois empíricos, e tem como objetivo geral analisar a relevância dos investimentos em pesquisa e desenvolvimento, ou P&D, para a geração de valor pelas firmas norte-americanas e o cenário atual da dicotomia empresas de alta e baixa tecnologia quanto ao perfil financeiro. Trabalhos recentes apontaram acentuado acréscimo dos investimentos em P&D nas empresas norte-americanas, elevando a intangibilidade dos ativos, e com potenciais consequências às demais decisões financeiras, como de liquidez. Diante disso, o primeiro capítulo analisa o conjunto de incentivos subjacente ao aumento dos investimentos em P&D. Contribuições da literatura em inovação foram organizadas conforme os três cenários da função de geração de valor pelas decisões de investimentos, que são compra, venda e inação, e permitiram apontar, usando proposições, evidências de facilitadores para a geração de valor por P&D. Por exemplo, a queda dos preços dos insumos pode incentivar empresas de setores de baixa tecnologia a engajarem em projetos de P&D, levando-as a acumular mais caixa para proteger o estoque de conhecimento recém-adquirido sem frustrar o pagamento das obrigações, tornando-se semelhante às empresas dos setores frequentemente nomeados como de alta tecnologia. O segundo artigo analisou a relação entre os investimentos em P&D efetuados ao longo de 2019 e os retornos anormais ocorridos em torno do choque da pandemia Covid-19. A ocorrência do choque||é útil para examinar a habilidade dos investidores em agir conforme as informações disponíveis e a relação entre a variável independente de interesse e a variável dependente com menor viés de endogeneidade, que ocorre se o administrador consegue manipular a variável dependente por meio da variável independente de interesse. Os resultados das regressões diff-in-diff apontaram que a relação positiva entre retornos anormais e gastos com P&D persistiu diante do choque. Usando o choque para regressões triple-diff, as empresas de alta tecnologia registraram vantagem para ofertar retornos em comparação às empresas de baixa tecnologia, sugerindo persistência da dicotomia empresas de alta e baixa tecnologia. O terceiro artigo repetiu o uso do choque da Covid-19 em regressões diff-in-diff e triple-diff. Dessa vez, para analisar a relação entre liquidez de curto prazo e retornos anormais, e a relevância da liquidez para a relação entre retornos anormais e gastos com P&D conforme a dicotomia empresas de alta tecnologia versus baixa tecnologia. Identificou-se equilíbrio entre custos e benefícios pelo acúmulo de liquidez, pela relação em forma de U invertido entre retornos anormais e a proporção de caixa diante dos ativos totais. Novamente, diante do choque o caixa foi mais relevante para as empresas de alta tecnologia gerarem retornos por projetos de P&D que para as empresas de baixa tecnologia, em mais um indício de persistência da dicotomia;This doctoral dissertation is composed of three papers, one theoretical and two empirical, and its general purpose is to analyze the relevance of R&D expenses for value creation and the current scenario of the dichotomy of high and low technology companies regarding the financial profile of US firms. Recent studies have pointed to a sharp increase in R&D expenses in US companies, increasing the intangibility of assets, and with potential consequences for other financial decisions, such as liquidity. Therefore, the first chapter analyzes the set of incentives underlying the increase in investments in R&D. Contributions from the literature on innovation were organized according to the three scenarios of the value generation function by investment decisions, which are buy, sell and inaction, and allowed to point out, using propositions, evidence of facilitators for the generation of value by R&D. For example, falling input prices can encourage companies in low-tech sectors to engage in R&D projects, leading them to accumulate more cash to protect the stock of newly acquired knowledge without frustrating the payment of obligations. Hence they came similar to companies in sectors often named as high tech. The second article analyzed the relationship between R&D expenses made throughout 2019 and the abnormal returns that occurred around the shock from Covid-19 pandemic. The occurrence of the shock is useful to examine investors' ability to act according to available information||and the relationship between the independent variable of interest and the dependent variable with less endogeneity bias, which occurs if the manager is able to manipulate the dependent variable through independent variable of interest. The results of the diff-in-diff regressions pointed out that the positive relationship between abnormal returns and R&D expenses persisted in the face of the shock. Using the shock for triple-diff regressions, high-tech companies registered an advantage in offering returns compared to low-tech companies, suggesting the persistence of the dichotomy of high- and low-tech companies. The third article repeated the use of the Covid-19 shock in diff-in-diff and triple-diff regressions. This time, to analyze the relationship between short-term liquidity and abnormal returns, and the relevance of liquidity to the relationship between abnormal returns and R&D expenditure according to the dichotomy of high-tech versus low-tech companies. A balance between costs and benefits was identified by the accumulation of liquidity, by the inverted U-shaped relationship between abnormal returns and the proportion of cash in relation to total assets. Again, given the shock, cash was more relevant for high-tech companies to generate returns from R&D projects than for low-tech companies, in yet another indication of the persistence of the dichotomy
3061568;Mosaner, Fabio Ferreira Lins;O desenho e o processo de produção da arquitetura;2021;;AUP;PROJETO DE ARQUITETURA;PROJETO DE ARQUITETURA||DESENHO||PROCESSOS PRÉ-FABRICADOS||INDUSTRIALIZAÇÃO DA CONSTRUÇÃO;Amorim, Anália Maria Marinho de Carvalho;"Esta tese investiga os processos de produção da arquitetura e aborda especialmente a relação entre o projeto de arquitetura e a execução de obras. Elegemos o Centro de Tecnologia da Rede Sarah (CTRS), situado na cidade de Salvador BA, como objeto de estudo. Esse centro foi concebido e dirigido pelo arquiteto João da Gama Filgueiras Lima (1932-2014), o Lelé, no período de 1992 a 2009. O objetivo central desta pesquisa foi reconstituir as práticas integradas de desenho de componentes construtivos industrializados, bem como sua montagem no canteiro de obras do CTRS, destacando-as como uma experiência ímpar de produção de arquitetura no Brasil. Para tanto, realizamos a combinação de pesquisa documental no acervo de projetos do CTRS, entrevistas a membros da equipe, consulta a depoimentos de Filgueiras Lima em relação aos procedimentos de trabalho e revisão bibliográfica. Também realizamos novos desenhos para sintetizar e apresentar as informações coletadas na pesquisa documental. Abordamos os seguintes edifícios: o Hospital Sarah Salvador, por ser a obra que deu origem ao CTRS; o próprio edifício do CTRS, por consolidar o uso do sistema construtivo; e o edifício da sede do Tribunal de Contas da união (TCU) em Salvador, por ser o primeiro projeto realizado por meio de convênio com outras instituições e apresentar inovações importantes que foram desenvolvidas e aplicadas nos demais projetos. O primeiro capítulo enfoca as relações entre conceber e construir na atuação profissional de Filgueiras Lima, para compreender de que modos a experiência pregressa do arquiteto fundamentou a criação do CTRS. O segundo capítulo descreve a implementação do CTRS, que teve início no canteiro de obras do Hospital Sarah Salvador. Demonstra como o canteiro de obras se transformou no Centro de Tecnologia.||Em seguida, apresenta as fases de projeto e as etapas da construção do edifício do CTRS. O terceiro capítulo expõe e analisa as etapas do processo de produção de edifícios empreendidos pelo CTRS. Para tanto, investiga a concepção dos edifícios através da produção dos desenhos, identificando seus tipos, suas funções comunicativas e sua utilização nas diversas fases de projeto; estuda a produção das peças nas oficinas e a montagem no canteiro de obras; e discute as articulações entre projeto, produção de peças e montagens nas obras. O quarto capítulo aborda os edifícios e equipamentos produzidos pelo CTRS, enfocando o período dos convênios. Para tanto, analisa o edifício-sede do TCU de Salvador, a partir do qual identificamos aperfeiçoamentos dos edifícios decorrentes das pesquisas realizadas pelo CTRS. Como resultado, observamos que a elaboração dos desenhos no CTRS ocorreu em diálogo com a produção nas oficinas e com a montagem no canteiro de obras, numa relação de cooperação e complementariedade. O CTRS realizou pesquisas no campo da construção civil por meio da concepção e da construção de edifícios, para ampliar e aperfeiçoar continuamente seu vocabulário de soluções técnicas. Esse conhecimento foi construído pelo trabalho de uma equipe multidisciplinar, que realizou pesquisa por meio de verificação e aprimoramento, em cada projeto. Em síntese, os saberes relacionados ao conceber e ao construir informaram e influenciaram mutuamente as práticas profissionais exercidas no CTRS";"This work investigates the production processes of architecture and addresses, in particular, the relationship between the architectural design and the execution of works. The Centro de Tecnologia da Rede Sarah (CTRS) [Technology Center of the Sarah Network], located in the city of Salvador-BA, was selected as the object of study. This center was designed by the architect João da Gama Filgueiras Lima (Lelé) (1932-2014), who oversaw the works from 1992 to 2009. The main objective of this research was to reconstruct the integrated design practices of industrialized construction components, as well as their assembly at the CTRS construction site, highlighting this as a unique experience in the production of architecture in Brazil. For this purpose, we carried out a combination of documentary research in the CTRS archives, interviews with team members, consultation of Filgueiras Limas accounts in relation to work procedures, and bibliographic review. We also created new designs to synthesize and present the information collected from the documentary research. We considered the following buildings: Sarah Salvador Hospital, as it is the construction that gave rise to the CTRS; the CTRS building itself, since it consolidates the use of the construction system; and the headquarters of the Federal Court of Accounts (TCU) in Salvador, as it is the first project carried out in partnership with other institutions and presents important innovations which were developed and applied in other projects. The first section focuses on the relationships between design and construction in the work of Filgueiras Lima in order to understand how the architects previous experience formed the basis for the creation of the CTRS. The second section describes the execution of the CTRS, on the site of the Sarah Salvador Hospital.||It demonstrates how the construction site was transformed into the Technology Center, detailing the stages of design and construction of the CTRS building. The third section presents and analyzes the stages of the building production process undertaken by the CTRS by investigating the design of buildings through the production of drawings - identifying their types, their communicative functions and their use during different phases of the project. It also addresses the manufacture of parts in workshops and assembly at the construction site, discussing the links between design, production of parts and on-site assembly. The fourth section considers the buildings and equipment produced by the CTRS, focusing on the period of parterships. We analyzed the TCU headquarters in Salvador, and identified improvements to the buildings resulting from the surveys carried out by the CTRS. We observed that the development of the drawings in the CTRS took place in tandem with the production in the workshops and with the assembly on the construction site, in a cooperative and complementary manner. The CTRS carried out research in the field of civil construction through the design and construction of buildings, continuously expanding and improving technical solutions. This knowledge was built through the work of a multidisciplinary team, which carried out research by verification and improvement in each project. In summary, the knowledge related to design and building informed and mutually influenced the professional practices applied in the CTRS"
