SYSNO;AUTOR;TÍTULO;ANO DE DEFESA;NOME DEPARTAMENTO;SIGLA DEPARTAMENTO;ÁREA DE CONCENTRAÇÃO;ASSUNTOS;ORIENTADOR;RESUMO;ABSTRACT
3061639;Machado, Luciene Oliveira;Estudo estrutural e termodifusivo das partículas de lipoproteína de baixa densidade - LDL;2021;;FEP;FÍSICA;ESPALHAMENTO DE RAIOS X A BAIXOS ÂNGULOS||LIPOPROTEÍNAS||LIPOPROTEÍNAS LDL;Figueiredo Neto, Antonio Martins;As doenças cardiovasculares estão, atualmente, entre as principais causas de morte em todo o mundo. A aterosclerose é uma dessas doenças cardiovasculares, sendo inflamatória, progressiva e caracterizada pelo acúmulo arterial de lipídios. A relação da lipoproteína de baixa densidade (LDL) com o desenvolvimento da aterosclerose já é conhecido, o que torna esta lipoproteína um importante objeto de estudo. A proposta do presente trabalho foi um estudo estrutural e termodifusivo das partículas de LDL. Foram empregadas no estudo as técnicas de varredura-Z (ZS), espectroscopia UV-vis, espalhamento dinâmico de luz (DLS) e espalhamento de raios X a baixos ângulos (SAXS). Os resultados estruturais indicaram haver alterações na distribuição da densidade eletrônica das partículas de LDL, em função do processo de oxidação induzido por íons Cu2+. Tais alterações, na estrutura da LDL, se mostraram dependentes da evolução temporal da oxidação in vitro. No que se refere à organização lipídica do núcleo da LDL, condição relacionada com a temperatura, os resultados sugeriram que, as alterações estruturais da partícula ocorrem independentemente desta organização. As variações, relacionadas à densidade eletrônica, foram também observadas no estudo in vivo, indicando mudanças na LDL em decorrência da ação de fármacos no organismo. Neste estudo, variações nos raios da partícula também foram observadas. Com relação aos estudos de termodifusão, o modelo de lente térmica generalizado, que permite a determinação do coeficiente Soret (S_T) por meio da técnica de varredura-Z (ZS), aplicada em duas escalas de tempo, foi a abordagem adotada para o estudo das partículas de LDL. Esta se apresenta como uma nova possibilidade no estudo de lipoproteínas plasmáticas.||As investigações, baseadas na indução dos fenômenos de lente térmica e lente de matéria em solução de nanopartículas, permitiu a determinação do S_T para as partículas de LDL, em condições análogas às fisiológicas, considerando-se força iônica, pH e temperatura. Um estudo da termodifusão da LDL oxidada in vitro sugeriu uma dependência do S_T com o estágio de oxidação da amostra, o que se sugere estar associado a variações de carga superficial da LDL oxidada.;Cardiovascular diseases, such as atherosclerosis, are among the main causes of death around the world. Atherosclerosis is a systemic and inflammatory disease characterized by arterial accumulation of lipids. The role of low-density lipoprotein (LDL) in the atherosclerosis development is known and extensively studied. The proposal of this work was a structural and thermodiffusion study of LDL particles. The techniques of Z-scan (ZS), UV-Vis spectroscopy, dynamic light scattering (DLS) and small angle X-ray scattering (SAXS) were employed. Structural results showed changes in electron density distribution of LDL as a result of oxidative process induced by Cu2+ ions. These structural changes in LDL were dependent of temporal evolution of in vitro oxidation. Our results suggested that structural modification was not inhibited by temperature-dependent lipid arrangement of oxidized LDL core. An in vivo study also indicated changes in electron density distribution of LDL as a result of drugs action, and variations in particle radius were also observed. With regard to thermodiffusion LDL investigation, the generalization of the thermal lens model formalism using Z-scan technique to determine Soret coefficient (S_T) was applied. This represents a new approach to studies of plasma lipoproteins. The investigations, based on thermal and matter lens in nanoparticles solution, allowed the determination of S_T from LDL particles under physiological conditions as regards ionic strength, pH and temperature. The study also suggested a dependence of S_T values to in vitro oxidized LDL on their oxidative stage, what can be thought to be associated with changes in surface charge of oxidized LDL.
3061640;Barbosa, Jacson Rodrigues;Heterogeneous information network to support the bug report resolution process;2021;;SSC;Ciências de Computação e Matemática Computacional;REDES DE INFORMAÇÃO||SOFTWARES||STAKEHOLDER||APRENDIZADO COMPUTACIONAL;Delamaro, Márcio Eduardo;Contexto. Ao longo do ciclo de vida de um software, inúmeros documentos (por exemplo, relatórios de incidentes e código fonte) são produzidos por stakeholders. Os relatórios de incidentes (RI) são os principais documentos de insumo para apoiar as atividades (predição da severidade de relatórios de incidentes e recomendação de responsáveis pela correção do software) do processo de resolução de relatórios de incidentes (RRI). Já o código fonte combinado com os relatórios de incidentes são insumos para apoiar atividades de localização de defeitos. A Automação dessas atividades do processo RRI requer uma preocupação em como obter uma representação semanticamente representativa. Tradicionalmente utiliza-se Bag-of-Word (BoW) para representar os documentos de software para apoiar a execução automática dessas atividades por meio de algoritmos de aprendizado de máquina. Lacuna. No entanto, pouca atenção foi dada para representações baseadas em redes de informações heterogêneas (RIH), que permitem representar redes complexas respeitando os relacionamentos entre diferentes objetos. Contribuição. Esta tese de doutorado contribui para o avanço do estado da arte no que se refere aos modelos de representação de informações para apoiar a execução automática de atividades do processo RRI. Também avança na investigação de (i) algoritmos semissupervisionados que utilizam redes heterogêneas bipartidas para apoiar a predição de severidade de RI, (ii) um método que combina a representação BoW e||redes de informações heterogêneas para apoiar a atividade de localização de defeitos, e (iii) uma abordagem holística que reutilizar uma rede de informações heterogêneas para apoiar atividades de RRI. Resultados. Os resultados demonstram que redes de informações heterogêneas podem ser uma alternativa promissora para apoiar a automação do processo RRI. Conclusões. Um processo RRI automático numa perspectica holística utilizando rede de informações heterogêneas apresentou resultados promissores ao serem comparados com representações do estado da arte.;Context. Throughout a softwares lifecycle, numerous documents (e.g., bug reports and source code) are produced by stakeholders. Bug reports (BR) are the primary input documents to support the activities (bug report severity prediction and fixer recommendation) of the bug report resolution (BRR) process. Source code combined with bug reports are resources to support troubleshooting activities. Automation of these activities of the BRR process requires a concern with obtaining a semantically representative representation. Traditionally, Bagof-Word (BoW) represents software documents to support the automatic execution of these activities through machine learning algorithms. Gap. However, little attention has been paid to representations based on heterogeneous information networks (HEN), which allow representing complex networks respecting the relationships between different objects. Contribution. This doctoral thesis contributes to advancing state of the art regarding information representation models to support the automatic execution of activities in the BRR process. It also advances in the investigation of (i) semi-supervised algorithms that use bipartite heterogeneous networks to support the bug report severity prediction, (ii) a method that combines the BoW representation and heterogeneous information networks to support the bug localization activity, and (iii) a holistic approach that reuses a heterogeneous information network to support BRR activities. Results. The||results demonstrate that heterogeneous information networks can be a promising alternative to support the automation of the BRR process. Conclusions. An automatic BRR process using a heterogeneous information network in a holistic perspective presented promising results compared with state-of-the-art representations.
3061673;Oblitas, Raissa Lima de;Caracterização de propriedades mecânicas da região cortical de fibras capilares humanas com mapeamento multiparamétrico por microscopia de força atômica;2021;;FAP;FÍSICA;FIBRAS NATURAIS||MICROSCÓPIO ELETRÔNICO||ELASTICIDADE;Salvadori, Maria Cecília Barbosa da Silveira;"Este trabalho apresenta a utilização da Microscopia de Força Atômica (AFM: Atomic Force Microscopy) para a avaliação da eficácia de um ativo cosmético, na melhora das propriedades mecânicas de fibras capilares humanas. Para isso, foram caracterizadas fibras capilares humanas sem e com danos químicos (grupo virgem e controle), causados pelo processo de descoloração. Para as amostras danificadas quimicamente, foi aplicado o produto sem e com ativo cosmético (grupo placebo e ativo). As fibras foram embebidas em resina epóxi e cortes foram realizados por ultramicrotomia, para observação das seções transversais por Microscopia Eletrônica de Transmissão (TEM). A superfície do bloco de resina, proveniente do corte, com seção transversal da fibra capilar exposta, foi utilizada para a caracterização por AFM. As propriedades mecânicas da seção transversal das fibras foram caracterizadas por AFM, no modo Force Volume (FV-AFM). No modo FV-AFM, registra-se uma curva força-distância (FC) em cada ponto da varredura, obtendo uma matriz 2D de FCs associada à imagem topográfica. Para cada FC foram obtidos dados de força de adesão entre a sonda e a amostra, deformação máxima da amostra pela sonda e módulo de Young (E). Os dados da fibra e da resina foram obtidos simultaneamente em um mapa, com a finalidade de ter os dados da resina como referência, de forma a garantir uma comparação coerente entre os grupos das fibras. Para comparação dos grupos das fibras, foram realizadas avaliações estatísticas utilizando o método ANOVA (Analysis of Variance), considerando nível de significância = 5%. Foi encontrado que o grupo controle mostrou um decréscimo estatisticamente significante no logaritmo natural do módulo de Young (ln(E)) em relação ao grupo de fibras virgens e que o grupo ativo apresentou aumento de (ln(E)) em relação ao grupo controle e em relação ao grupo placebo.||Os resultados demonstraram a degradação das fibras do grupo controle, corroborando com a análise realizada por TEM; e a aplicação do produto com ativo foi eficaz na melhora do módulo de Young da fibra danificada. Também encontramos uma diminuição radial de ln(E) ao longo da seção transversal da fibra do grupo ativo, o que é compatível com o resultado obtido pela análise de Confocal Raman Spectroscopy, o qual apresentou variação da permeação do ativo ao longo da profundidade. Vale ressaltar que o módulo de Young também foi determinado por Tensile Tester, no qual não foi possível verificar diferenças estatisticamente significantes entre os grupos, evidenciando a vantagem da análise por FV-AFM. Também foi encontrado a prevalência de diminuição de ln(E) para maiores forças de adesão entre a ponta e a amostra, por meio da análise do coeficiente de correlação de Pearson r. Esse resultado pode corroborar com a presença de estruturas adesivas diferenciadas (Cell Membrane Complex - CMC com baixo teor de cistina), que apresentam baixo módulo de Young.";"In this work, by use of Atomic Force Microscopy, we show the evaluation of the effectiveness of a cosmetic active improving the mechanical properties of human hair fibers. For this, we characterized human hair fibers without and with chemical damage (virgin and control group) caused by bleaching process, using Atomic Force Microscopy (AFM). For chemically damaged samples, product without and with cosmetic active (placebo and active group) was applied. The fibers were embedded in epoxy resin and cuts were made by ultramicrotomy, for observing cross-sections by Transmission Electron Microscopy (TEM). The resin block surface from the cut with exposed hair fiber cross-section, was used for the characterization by AFM. Mechanical properties of the fibers cross-section surface were characterized by AFM, in Force Volume (FV-AFM) mode. FV-AFM records a force-distance curve (FC) at each point of the scan, obtaining a 2D matrix of FCs associated with topographic images. For each FC, it was obtained adhesion force between probe and sample, maximum sample deformation by the probe and Youngs modulus (E) data. The fiber and resin data were obtained simultaneously in a map for the purpose of having the resin data as a reference, to ensure a coherent comparison between the fibers groups. To compare the fibers groups, statistical evaluations were performed using the ANOVA (Analysis of Variance) method, considering the significance level = 5%. We found that the control group, showed a statistically significant decrease in the natural logarithm of Young's modulus (ln (E)) concerning the virgin fibers group and, the active group presented an increase of (ln (E)), concerning the control group and placebo group. Our results demonstrated the fiber degradation of the control group, corroborating with TEM analysis; and the application of the product with active was effective in improving the Young's modulus of the damaged fiber.||We also found a radial decrease of ln(E) along the cross-section of the active group fiber, which is compatible with the results obtained by Confocal Raman Spectroscopy analysis, that presented variation of the active permeation along the depth. It is worth mentioning that the Young's modulus was also determined by Tensile Tester, in which it was not possible to verify statistically significant differences between the groups, evidencing the advantage of the FV-AFM analysis. We also found the prevalence of decrease of ln(E) for higher adhesion force between tip and sample, using Pearson's correlation coefficient analysis r. This result may corroborate with the presence of differentiated adhesive structures (Cell Membrane Complex - CMC with low cystine contents), which have low Young's modulus."
3061675;Santos Junior, Djacinto Aparecido Monteiro dos;Análise dos processos de formação de aerossóis orgânicos secundários na macrorregião metropolitana de São Paulo;2021;;FAP;FÍSICA;ANÁLISE FATORIAL||BIG DATA||ESPECTROMETRIA DE MASSAS||POLUIÇÃO ATMOSFÉRICA||QUÍMICA ATMOSFÉRICA;Artaxo Netto, Paulo Eduardo;A macrometrópole Paulista (MMP), conjunto de metrópoles incluindo a Região Metropolitana de São Paulo, com população superior a 33 milhões de habitantes, é uma região crítica do ponto de vista da poluição atmosférica. Foram estudadas propriedades físicas e químicas de aerossóis urbanos na MMP, bem como os processos de formação de aerossóis orgânicos secundários (SOA) por meio de experimentos realizados nos municípios de Diadema, Campinas e São Paulo. Foram utilizadas técnicas como espectrometria de massas de aerossóis e fatoração de matriz positiva. A concentração média de partículas submicrométricas (PM1) foi de 11,3 g/m3 em Diadema, 12,0 g/m3 em Cerqueira César e 13,4 g/m3 em Campinas, sendo predominantemente aerossóis orgânicos (OA) (43% - 58%) e Black Carbon (BC) (14% a 24%). Os sítios de São Paulo (Cerqueira César) e Diadema foram caracterizados pelo impacto de emissões veiculares, enquanto em Campinas verificou-se maior influência de poluição regional e emissões de queimadas. Processos secundários foram responsáveis por 56% da massa total de PM1 em Campinas, 54% em Diadema e 46% em Cerqueira César. Aerossóis da moda de Aitken apresentaram contribuição majoritária de espécies inorgânicas, enquanto a moda de acumulação foi dominada por partículas de BC e SOA. Entre as componentes químicas do aerossol, aerossóis inorgânicos de sulfato e nitrato apresentaram a maior eficiência de espalhamento em massa do PM1. Com relação aos coeficientes de absorção, a contribuição de OA foi quantificada em 23% da absorção total na faixa entre 370 e 880 nm, amplificando a absorção de radiação associada ao BC.;The São Paulo macrometropolis (MMP), a group of municipalities around the Metropolitan Region of São Paulo, with a population of more than 33 million inhabitants, is a critical region concerning atmospheric pollution. In this work, physicochemical properties of urban aerosols in MMP were studied, focusing on the mechanisms of production and processing of secondary organic aerosols (SOA), through aerosol mass spectrometry (AMS) and Positive Matrix Factorization (PMF) analysis. The average concentrations of PM1 were 11.3 g/m3 in Diadema, 12.0 g/m3 in Cerqueira César and 13.4 g/m3 in Campinas, dominated by organic aerosol (OA) (43% - 58%) and Black Carbon (BC) (14% to 24%). Diadema and Cerqueira César sampling sites were characterized by a high impact of vehicular emissions. The Campinas site presents more processed aerosols, regional transport, and the impact of biomass burning. The secondary formation was responsible for 54%, 56%, and 46% of the total mass of total PM1 in Diadema, Campinas, and Cerqueira César, respectively. The Aitken mode showed a major contribution from secondary inorganic species of the aerosol. On the other hand, the accumulation mode presented a significant contribution from eBC and OA, mainly from SOA. Among aerosol species, sulfate and nitrate presented the highest mass scattering efficiency. In terms of absorption, the contribution of OA was 23% for absorption coefficients in the 370-880 nm range, which amplifies BC absorption.
3061681;Noronha, Raquel Maria Nogueira Wood;Representação de funcionais lineares em hiper-ideais de operadores multilineares e de polinômios homogêneos;2021;;MAT;MATEMÁTICA;ESPAÇOS DE BANACH||POLINÔMIOS N-HOMOGÊNEOS EM ESPAÇOS DE BANACH||OPERADORES LINEARES;Botelho, Geraldo Márcio de Azevedo;"Nesta tese introduzimos a hiper-transformada de Borel como ferramenta para representar funcionais lineares em hiper-ideais de operadores multilineares entre espaços de Banach. E também a hiper-transformada de Borel polinomial para representar funcionais lineares em hiper-ideais de polinômios homogêneos. Essas transformadas são aplicadas para representar funcionais lineares em espaços de operadores multilineares e polinômios homogêneos que são: aproximáveis por operadores/polinômios de posto finito, compactos, hiper-(s;r)-nucleares e hiper-sigma(p)-nucleares. Uma nova técnica para gerar hiper-ideais de operadores multilineares e hiper-ideais e ideais bilaterais de polinômios também é desenvolvida";"In this work we introduce the hyper-Borel transform as a tool to represent linear functionals on hyper-ideals of multilinear operators between Banach spaces. And also the polynomial hyper-Borel transform to represent linear functionals on hyper-ideals of homogeneous polynomials. These transforms are applied to represent linear functionals on spaces of multilinear operators and homogeneous polynomials which are: approximable by finite rank operators/polynomials, compact, hyper-(s;r)-nuclear and hyper-sigma(p)-nuclear. A new technique to generate hyper-ideals of multilinear operators and hyper-ideals and two-sided ideals of homogeneous polynomials is also developed"
3061684;Jesus, João Paulo Cirineu de;Ultraprodutos métricos e normados e ultrassomas topológicas;2021;;MAT;MATEMÁTICA;PSEUDOMÉTRICAS CONTÍNUAS||ESPAÇOS DE BANACH||ESPAÇOS MÉTRICOS;Fajardo, Rogério Augusto dos Santos;Neste trabalho, são estabelecidas generalizações de definições e resultados da teoria dos ultraprodutos de espaços métricos pontuados, no contexto dos espaços pseudométricos, e da teoria dos ultraprodutos de espaços normados e de Banach reais ou complexos, no contexto dos espaços pseudonormados sobre subcorpos quaisquer do corpo dos números complexos. Na teoria dos conjuntos de Zermelo-Fraenkel com o Teorema do Ultrafiltro, é apresentada uma introdução detalhada à teoria das ultrassomas de espaços topológicos de Tychonoff. Na teoria dos conjuntos de Zermelo-Fraenkel com o Axioma da Escolha, é demonstrada uma generalização do resultado de estabilidade sob ultraprodutos da classe dos espaços de funções reais contínuas que estão definidas em algum espaço topológico compacto e de Hausdorff;In this work, we establish a generalization of definitions and results from the theory of ultraproducts of pointed metric spaces in the setting of pseudometric spaces and from the theory of ultraproducts of real or complex normed spaces in the setting of pseudonormed spaces over any subfields of the field of complex numbers. We present in the Zermelo-Fraenkel set theory with the Ultrafilter Theorem a detailed introdution to the theory of ultrasums of Tychonoff topological spaces. We proof in the Zermelo-Fraenkel set theory with the Axiom of Choice a generalization of the result of stability under ultraproducts of the class of spaces of continuous real-valued functions which are defined on some Hausdorff and compact topological space
3061685;Hernandez, Lorena Soriano;Eigenvalue problems for Schrödinger-Bopp-Podolsky systems;2021;;MAT;MATEMÁTICA;OPERADORES||EQUAÇÃO DE SCHRODINGER||MÉTODOS TOPOLÓGICOS;Siciliano, Gaetano;Esta tese está no marco do estudo da classe de sistemas de equações Schrödinger-Bopp-Podolsky. Como novidade, aplicamos metódos topologicos para encontrar soluções das equações que involvem o operador Bi-Laplaciano assim como a obtenção de soluções definidas em subconjuntos de R N sendo N 3;This work is framed in the study of a class of Schrödinger-Bopp-Podolsky systems. As a novelty, we apply topological methods to find solutions of equations that involve the bi-Laplacian operator as well as such solutions are defined in subsets of R N where N 3
3061686;Conceição, Hevelyn Rosa Machert da;As mulheres nas políticas públicas de saúde dos anos 2000;2021;;;SAÚDE PÚBLICA;POLÍTICA DE SAÚDE||SAÚDE DA MULHER||MOVIMENTOS SOCIAIS||IDENTIDADE DE GÊNERO;Cabral, Cristiane da Silva;"Essa tese investiga as contingências que conferem possibilidade de existência para as políticas públicas de saúde da mulher dos anos 2000, com destaque para os modos pelos quais esse sujeito a(s) mulher(es) - é conformado pelas políticas. Desse modo, os objetivos consistem em: descrever e analisar as políticas públicas de saúde voltadas às mulheres, seus princípios e os contextos sócio-históricos específicos onde se inscrevem; e identificar e compreender os modos como a mulher é caracterizada nas políticas públicas voltadas à saúde da mulher no Brasil. Foram analisadas a Política Nacional de Atenção Integral à Saúde da Mulher (PNAISM) e a Rede Cegonha, por meio do estudo de seus textos e das contingências políticas e históricas de ambas, com inspiração na perspectiva antropológica de análise de documentos e na abordagem genealógica da história. O estudo do contexto é realizado por meio de três eixos: movimentos sociais; institucionalidade estatal; e fomento à produção de conhecimento científico. Os resultados da pesquisa foram discutidos a partir da análise do processo de produção do sexo e do gênero; e do co-imbricamento entre Estado, movimentos sociais e mulher. O percurso analítico possibilitou concluir que as políticas de saúde da mulher dos anos 2000 mostram-se como planos nos quais se disputou as definições de mulher, os modelos de atenção à saúde e com forte tensionamento da relação entre movimentos sociais e Estado na arena dos direitos reprodutivos";
